{
  "$schema": "https://assert-iq.io/schemas/rubric-v1.0.json",
  "rubric_id": "test-unit-v1.0",
  "artifact_type": "automated-unit-test",
  "title": "Unit Test Acceptance Contract",
  "description": "Criteria for a well-written unit test. Used to evaluate single-function/class tests in isolation.",
  "maturity_tiers": ["early", "mid", "higher"],
  "dimensions": [
    {
      "id": "assertion_clarity",
      "name": "Assertion clarity",
      "weight": 1.0,
      "criterion": "Each assertion documents what is being verified and why it matters",
      "levels": [
        {
          "level": "PASS",
          "definition": "All assertions have inline comments OR descriptive assert messages that explain the criterion"
        },
        {
          "level": "CONDITIONAL",
          "definition": "70%+ of assertions have comments/messages; remaining are self-evident from context"
        },
        {
          "level": "FAIL",
          "definition": "Assertions lack context; reader must infer intent from code structure alone"
        }
      ]
    },
    {
      "id": "independence",
      "name": "Test independence",
      "weight": 0.8,
      "criterion": "Test does not depend on external state, run order, or side effects from other tests",
      "levels": [
        {
          "level": "PASS",
          "definition": "Test has setup fixture; no shared state, no DB dependencies, no test ordering assumptions"
        },
        {
          "level": "CONDITIONAL",
          "definition": "Test is mostly isolated but has minor setup assumptions or mocked external calls"
        },
        {
          "level": "FAIL",
          "definition": "Test reads/modifies shared mutable state or has undeclared dependencies on other tests"
        }
      ]
    },
    {
      "id": "determinism",
      "name": "Test determinism",
      "weight": 0.9,
      "criterion": "Test produces same verdict on every run (no flake)",
      "levels": [
        {
          "level": "PASS",
          "definition": "Test passes or fails consistently; no sleep() calls, floating-point comparisons, or timing assumptions"
        },
        {
          "level": "CONDITIONAL",
          "definition": "Test mostly deterministic but has minor timing-dependent logic or occasional external calls"
        },
        {
          "level": "FAIL",
          "definition": "Test has sleep() calls, floating-point equality checks, or external service dependencies without mocks"
        }
      ]
    },
    {
      "id": "focus",
      "name": "Test focus",
      "weight": 0.7,
      "criterion": "Test verifies ONE thing; not a multi-scenario integration",
      "levels": [
        {
          "level": "PASS",
          "definition": "Test has one logical assertion target; test name describes exactly what it verifies"
        },
        {
          "level": "CONDITIONAL",
          "definition": "Test verifies 2–3 related behaviors; still reasonably focused"
        },
        {
          "level": "FAIL",
          "definition": "Test verifies many unrelated behaviors; looks more like an integration test"
        }
      ]
    }
  ],
  "passing_criteria": "All dimensions at PASS level, OR weighted average score >= 0.85",
  "metadata": {
    "author": "assert-iq-pack",
    "created_at": "2026-08-11T00:00:00Z",
    "version": "1.0",
    "tags": ["unit-test", "automated", "acceptance-contract"]
  }
}
